name,email,phone,message
Carlos Barrientos,carlos@empresa.com,+51987001001,Necesito implementar esto antes de fin de mes tenemos presupuesto aprobado
Laura Quispe,laura@gmail.com,+51987001002,Solo estoy viendo opciones por ahora nada urgente
Diego Salas,diego@corp.com,+51987001003,Cuánto cuesta? Necesito comparar con otras opciones
Ana Torres,ana@startup.com,+51987001004,Somos una startup de 50 personas y necesitamos escalar urgente
Roberto Paz,roberto@gmail.com,+51987001005,Me mandaron este link no sé muy bien de qué trata